{
  "contract_version": "1.0.0",
  "task_id": "22222222-2222-4222-8222-222222222222",
  "run_id": "11111111-1111-4111-8111-111111111111",
  "status": "SUCCEEDED",
  "message": "Context received and callback submitted through the central API.",
  "received_context_hash": "sha256:bbbbbbbbbbbbbbbbbbbbbbbbbbbbbbbbbbbbbbbbbbbbbbbbbbbbbbbbbbbbbbbb",
  "emitted_at": "2026-08-22T16:00:03Z"
}
